{
  "schema_version": "pc-review-project-1.0",
  "document_type": "pc_review_project",
  "export_timestamp": "2026-08-17T08:10:00.000Z",
  "project": {
    "project_id": "pc_project_demo_001",
    "project_name": "DEMO - Particular Conditions Review",
    "contract_reference": "DEMO-CONTRACT-001",
    "fidic_form": "Red Book",
    "fidic_edition": "2017",
    "baseline_id": "fidic_red_2017",
    "baseline_verification_status": "Not Verified",
    "created_at": "2026-08-17T08:00:00.000Z",
    "updated_at": "2026-08-17T08:06:00.000Z",
    "project_status": "Clause Alignment Not Started",
    "source_document_ids": ["pc_source_demo_txt_001"],
    "amendment_ids": ["amendment_demo_001", "amendment_demo_002", "amendment_demo_003", "amendment_demo_004"],
    "notes": "DEMO synthetic workflow data only. It is not legal analysis and contains no FIDIC clause wording."
  },
  "source_documents": [
    {
      "source_document_id": "pc_source_demo_txt_001",
      "project_id": "pc_project_demo_001",
      "file_name": "DEMO_particular_conditions.txt",
      "file_type": "txt",
      "file_size": 426,
      "selected_at": "2026-08-17T08:01:00.000Z",
      "document_role": "Particular Conditions",
      "extraction_status": "Text Extracted",
      "preprocessing_status": "Not Assessed",
      "processing_status": "Amendments Identified",
      "verification_status": "Not Verified",
      "extracted_text": "DEMO-PC 1.1 - In the project rule titled \"Weekly Coordination\", replace the words \"every Friday\" with \"every Wednesday\".\n\nDEMO-PC 2.1 - Add a new project rule after DEMO-PC 2 stating: \"The Site Log shall include a daily weather entry.\"\n\nDEMO-PC 3.1 - In this DEMO only, the defined term \"Review Day\" means a calendar day on which the review team is scheduled to meet.\n\nDEMO-PC 4.1 - Adjust the notice timing where appropriate.",
      "extraction_method": "Browser FileReader.readAsText",
      "extraction_error": null,
      "source_hash": null,
      "notes": "Synthetic DEMO TXT metadata. No physical source file is bundled."
    }
  ],
  "amendments": [
    {
      "amendment_id": "amendment_demo_001",
      "project_id": "pc_project_demo_001",
      "pc_source_document_id": "pc_source_demo_txt_001",
      "pc_source_reference": "DEMO-PC 1.1",
      "pc_instruction_text": "DEMO-PC 1.1 - In the project rule titled \"Weekly Coordination\", replace the words \"every Friday\" with \"every Wednesday\".",
      "pc_instruction_summary": "Changes the synthetic weekly coordination day.",
      "pc_clause_number": "DEMO-1.1",
      "pc_clause_heading": "Weekly Coordination",
      "parent_clause": "DEMO-PC 1",
      "target_gc_clause_id": null,
      "target_gc_clause_number": null,
      "target_gc_heading": null,
      "amendment_operation": "Replace Exact Text",
      "target_text": "every Friday",
      "replacement_or_added_text": "every Wednesday",
      "sequence_number": 1,
      "amendment_category": "Clause-specific Amendment",
      "alignment_status": "Not Assessed",
      "application_status": "Not Assessed",
      "verification_status": "Not Verified",
      "effective_clause_id": null,
      "effective_location": null,
      "affected_element_ids": [],
      "affected_tag_ids": [],
      "global_dependency_ids": [],
      "human_review_required": false,
      "source_confidence": null,
      "notes": "DEMO data capture only."
    },
    {
      "amendment_id": "amendment_demo_002",
      "project_id": "pc_project_demo_001",
      "pc_source_document_id": "pc_source_demo_txt_001",
      "pc_source_reference": "DEMO-PC 2.1",
      "pc_instruction_text": "DEMO-PC 2.1 - Add a new project rule after DEMO-PC 2 stating: \"The Site Log shall include a daily weather entry.\"",
      "pc_instruction_summary": "Adds a synthetic daily weather-log rule.",
      "pc_clause_number": "DEMO-2.1",
      "pc_clause_heading": "Daily Site Log",
      "parent_clause": "DEMO-PC 2",
      "target_gc_clause_id": null,
      "target_gc_clause_number": null,
      "target_gc_heading": null,
      "amendment_operation": "Add New Sub-Clause",
      "target_text": null,
      "replacement_or_added_text": "The Site Log shall include a daily weather entry.",
      "sequence_number": 2,
      "amendment_category": "New Clause",
      "alignment_status": "Not Assessed",
      "application_status": "Not Assessed",
      "verification_status": "Not Verified",
      "effective_clause_id": null,
      "effective_location": null,
      "affected_element_ids": [],
      "affected_tag_ids": [],
      "global_dependency_ids": [],
      "human_review_required": false,
      "source_confidence": null,
      "notes": "Synthetic location only; no baseline alignment has been attempted."
    },
    {
      "amendment_id": "amendment_demo_003",
      "project_id": "pc_project_demo_001",
      "pc_source_document_id": "pc_source_demo_txt_001",
      "pc_source_reference": "DEMO-PC 3.1",
      "pc_instruction_text": "DEMO-PC 3.1 - In this DEMO only, the defined term \"Review Day\" means a calendar day on which the review team is scheduled to meet.",
      "pc_instruction_summary": "Records a synthetic defined-term amendment for deferred treatment.",
      "pc_clause_number": "DEMO-3.1",
      "pc_clause_heading": "Defined Term - Review Day",
      "parent_clause": "DEMO-PC 3",
      "target_gc_clause_id": null,
      "target_gc_clause_number": null,
      "target_gc_heading": null,
      "amendment_operation": "Amend Defined Term",
      "target_text": "Review Day",
      "replacement_or_added_text": "a calendar day on which the review team is scheduled to meet",
      "sequence_number": 3,
      "amendment_category": "Defined-term Amendment",
      "alignment_status": "Not Assessed",
      "application_status": "Identified – Deferred",
      "verification_status": "Not Verified",
      "effective_clause_id": null,
      "effective_location": null,
      "affected_element_ids": [],
      "affected_tag_ids": [],
      "global_dependency_ids": [],
      "human_review_required": false,
      "source_confidence": null,
      "notes": "Captured but not applied."
    },
    {
      "amendment_id": "amendment_demo_004",
      "project_id": "pc_project_demo_001",
      "pc_source_document_id": "pc_source_demo_txt_001",
      "pc_source_reference": "DEMO-PC 4.1",
      "pc_instruction_text": "DEMO-PC 4.1 - Adjust the notice timing where appropriate.",
      "pc_instruction_summary": "Ambiguous synthetic timing instruction with no identified target.",
      "pc_clause_number": "DEMO-4.1",
      "pc_clause_heading": "Unresolved Notice Timing",
      "parent_clause": "DEMO-PC 4",
      "target_gc_clause_id": null,
      "target_gc_clause_number": null,
      "target_gc_heading": null,
      "amendment_operation": "Unclassified Instruction",
      "target_text": null,
      "replacement_or_added_text": null,
      "sequence_number": 4,
      "amendment_category": "Unclassified Instruction",
      "alignment_status": "Not Assessed",
      "application_status": "Not Assessed",
      "verification_status": "Not Verified",
      "effective_clause_id": null,
      "effective_location": null,
      "affected_element_ids": [],
      "affected_tag_ids": [],
      "global_dependency_ids": [],
      "human_review_required": true,
      "source_confidence": null,
      "notes": "Human review is required; no target has been inferred."
    }
  ],
  "processing_history": [
    {
      "event_id": "event_demo_001",
      "project_id": "pc_project_demo_001",
      "source_document_id": "pc_source_demo_txt_001",
      "amendment_id": null,
      "timestamp": "2026-08-17T08:01:00.000Z",
      "previous_status": null,
      "new_status": "Source Loaded",
      "action": "Registered DEMO TXT source metadata",
      "actor": "DEMO Fixture",
      "notes": null
    },
    {
      "event_id": "event_demo_002",
      "project_id": "pc_project_demo_001",
      "source_document_id": "pc_source_demo_txt_001",
      "amendment_id": null,
      "timestamp": "2026-08-17T08:02:00.000Z",
      "previous_status": "Source Loaded",
      "new_status": "Text Extracted",
      "action": "Recorded synthetic extracted TXT text",
      "actor": "DEMO Fixture",
      "notes": "No automatic amendment extraction was performed."
    },
    {
      "event_id": "event_demo_003",
      "project_id": "pc_project_demo_001",
      "source_document_id": "pc_source_demo_txt_001",
      "amendment_id": null,
      "timestamp": "2026-08-17T08:04:00.000Z",
      "previous_status": "Amendments Not Yet Identified",
      "new_status": "Amendments Identified",
      "action": "Imported four pre-structured DEMO amendment entries",
      "actor": "DEMO Fixture",
      "notes": "This does not represent automatic extraction."
    },
    {
      "event_id": "event_demo_004",
      "project_id": "pc_project_demo_001",
      "source_document_id": "pc_source_demo_txt_001",
      "amendment_id": "amendment_demo_004",
      "timestamp": "2026-08-17T08:06:00.000Z",
      "previous_status": "Not Assessed",
      "new_status": "Human Review Required",
      "action": "Flagged ambiguous DEMO instruction",
      "actor": "DEMO Fixture",
      "notes": "The target remains deliberately unidentified."
    }
  ]
}
